{
  "schema_version": "1.0.0",
  "generated_at": "2025-12-09T19:43:19.373986+00:00",
  "model_name": "mhw4d.gms",
  "total_duration_ms": 691.1631780094467,
  "overall_success": true,
  "stages": {
    "Parse": {
      "duration_ms": 677.1147090184968,
      "success": true,
      "error": null,
      "details": {
        "sets": 0,
        "parameters": 4,
        "variables": 6,
        "equations": 4
      }
    },
    "Semantic Analysis": {
      "duration_ms": 0.18957600696012378,
      "success": true,
      "error": null,
      "details": {
        "equalities": 0,
        "inequalities": 0
      }
    },
    "Simplification": {
      "duration_ms": 1.3600240054074675,
      "success": true,
      "error": null,
      "details": {
        "vars_added": 0,
        "eqs_added": 0,
        "normalized_equations": 4
      }
    },
    "IR Generation": {
      "duration_ms": 11.829111987026408,
      "success": true,
      "error": null,
      "details": {
        "gradient_cols": 6,
        "eq_jacobian_rows": 4,
        "ineq_jacobian_rows": 0,
        "stationarity_eqs": 5
      }
    },
    "MCP Generation": {
      "duration_ms": 0.6697569915559143,
      "success": true,
      "error": null,
      "details": {
        "output_lines": 108,
        "output_bytes": 2995
      }
    }
  },
  "summary": {
    "stages_completed": 5,
    "stages_failed": 0,
    "stages_skipped": 0,
    "parse_duration_ms": 677.1147090184968,
    "semantic_duration_ms": 0.18957600696012378,
    "simplification_duration_ms": 1.3600240054074675,
    "ir_generation_duration_ms": 11.829111987026408,
    "mcp_generation_duration_ms": 0.6697569915559143
  }
}